{
  "_schema_version": "1.0.0",
  "_filled_ratio": 1.0,
  "idea_summary": "공방 운영자가 수업·재고·정산을 한 곳에서",
  "target_persona": {
    "profile": "1-3인 공방 운영자 (도예/가죽/플라워)",
    "primary_pain": "수기 장부 + 카카오톡 예약 + 엑셀 재고로 운영 분산",
    "usage_frequency": "daily"
  },
  "primary_surface": {
    "platform": "web",
    "sync_model": "real-time",
    "offline_capable": false
  },
  "jobs_to_be_done": {
    "functional": "수업 예약·재고·매출을 한 화면에서 관리",
    "emotional": "운영의 통제감",
    "social": "체계적인 사업주로 보이고 싶음"
  },
  "killer_feature": "수업·재고·정산 단일 뷰",
  "must_have_constraints": [
    {
      "type": "regulatory",
      "value": "한국 부가세 신고용 매출 export"
    }
  ],
  "non_goals": [
    "인사·급여 모듈",
    "다국어 UI"
  ],
  "monetization_model": "subscription",
  "success_metric": "월간 활성 매장 수 (MAU at venue level)"
}