{
  "_schema_version": "1.0.0",
  "_filled_ratio": 1.0,
  "idea_summary": "legal depo paralegal tool",
  "target_persona": {
    "profile": "litigation paralegal at small US law firm",
    "primary_pain": "Manually indexing deposition transcripts for trial prep",
    "usage_frequency": "weekly"
  },
  "primary_surface": {
    "platform": "desktop",
    "sync_model": "batch",
    "offline_capable": true
  },
  "jobs_to_be_done": {
    "functional": "Auto-index deposition transcripts with cite-pin to PDF page",
    "emotional": "Confidence that no contradiction was missed before trial",
    "social": "Be the paralegal partners trust with deposition prep"
  },
  "killer_feature": "Cite-pinned contradiction detection across multi-witness depositions",
  "must_have_constraints": [
    {
      "type": "regulatory",
      "value": "Attorney-client privilege — local-only processing"
    },
    {
      "type": "data_residency",
      "value": "Files never leave firm's machine"
    }
  ],
  "non_goals": [
    "Court e-filing integration",
    "Billing/time-tracking"
  ],
  "monetization_model": "subscription",
  "success_metric": "Average minutes saved per deposition prep"
}