{
  "idea_summary": "Solo-founder React PWA",
  "target_persona": {
    "profile": "solo founder",
    "primary_pain": null,
    "usage_frequency": null
  },
  "primary_surface": {
    "platform": "web",
    "sync_model": null,
    "offline_capable": null
  },
  "_filled_ratio": 0.5,
  "_schema_version": "1.7.0"
}
