{
  "_schema_version": "1.0.0",
  "_filled_ratio": 0.7777777777777778,
  "idea_summary": "API for async meeting transcription",
  "target_persona": {
    "profile": "SaaS developer adding meeting intelligence",
    "primary_pain": "Building ML transcription infra is time-consuming",
    "usage_frequency": "daily"
  },
  "primary_surface": {
    "platform": "api",
    "sync_model": "eventual",
    "offline_capable": null
  },
  "jobs_to_be_done": {
    "functional": "Upload audio, receive diarized transcript via webhook",
    "emotional": null,
    "social": null
  },
  "killer_feature": "Single-endpoint REST API with webhook callback",
  "must_have_constraints": [
    {
      "type": "latency",
      "value": "Webhook fired within 2x audio duration"
    }
  ],
  "non_goals": [
    "Live streaming transcription"
  ],
  "monetization_model": "transaction_fee",
  "success_metric": null
}